{"$schema":"https://json-schema.org/draft/2020-12/schema","additionalProperties":false,"properties":{"canonical_future_lock_path":{"pattern":"^(?!/)(?!.*(?:^|/)\\.\\.(?:/|$))(?!.*\\\\).+$","type":"string"},"imports":{"items":{"additionalProperties":false,"properties":{"binding_scope":{"minLength":1,"type":"string"},"dependency_id":{"enum":["AF","AFC","GM","AOD"]},"import_id":{"minLength":1,"type":"string"},"normalized_profile":{"pattern":"^(?!/)(?!.*(?:^|/)\\.\\.(?:/|$))(?!.*\\\\).+$","type":"string"},"path":{"pattern":"^(?!/)(?!.*(?:^|/)\\.\\.(?:/|$))(?!.*\\\\).+$","type":"string"},"provenance_status":{"enum":["legacy_bootstrap_hash_locked_noncanonical_fallback","resolved_release_supersedes_bootstrap"]},"role":{"minLength":1,"type":"string"},"sha256":{"pattern":"^[0-9a-f]{64}$","type":"string"}},"required":["dependency_id","import_id","path","sha256","normalized_profile","role","binding_scope","provenance_status"],"type":"object"},"maxItems":4,"minItems":4,"type":"array"},"policy":{"minLength":1,"type":"string"},"release_source_registry_path":{"pattern":"^(?!/)(?!.*(?:^|/)\\.\\.(?:/|$))(?!.*\\\\).+$","type":"string"},"schema_version":{"const":"3.1"}},"required":["schema_version","release_source_registry_path","canonical_future_lock_path","policy","imports"],"title":"Rolling Latest Governance Import Manifest","type":"object"}
