{"canonical_future_lock_path":"governance/UPSTREAM_RELEASE_LOCK.json","imports":[{"binding_scope":"all authoring, review, feedback, and GO records","dependency_id":"AF","import_id":"AF_PROTOCOL_2025_08_08","normalized_profile":"governance/AF_PROTOCOL_PROFILE.json","path":"governance/imports/axiomatic-fundamentalism.pdf","provenance_status":"legacy_bootstrap_hash_locked_noncanonical_fallback","role":"authoring_and_review_governance","sha256":"2ca94a78ee80476bc7dadd367a47a40be5bd5fd54bcb446f27f9cbae0b5572a6"},{"binding_scope":"cycle state distinctions, relations, boundary accounting, and derived procedural motif","dependency_id":"AFC","import_id":"AFC_MAIN_2025_12_07","normalized_profile":"governance/AFC_PROCEDURAL_DYNAMICS.json","path":"governance/imports/afc-main.zip","provenance_status":"legacy_bootstrap_hash_locked_noncanonical_fallback","role":"procedural_calculus_basis","sha256":"24587c1ddd7dd5b7673795adf97954a3b40e6480fef54a9d8917e6d77ac0b950"},{"binding_scope":"human-readable reports and formal explanatory records","dependency_id":"GM","import_id":"GENERAL_MECHANICS_1_0_5_0","normalized_profile":"governance/GENERAL_MECHANICS_STYLE_PROFILE.json","path":"governance/imports/general-mechanics-1.0.5.0.zip","provenance_status":"legacy_bootstrap_hash_locked_noncanonical_fallback","role":"authoring_and_review_style","sha256":"5d9171e1b4518d975ad3486aaa6d09a781cc60877a950cc0a23da157c37c4736"},{"binding_scope":"stable project-release baseline and candidate rebase provenance","dependency_id":"AOD","import_id":"AOD_STABLE_BOOTSTRAP_v40.03r15.2_GO","normalized_profile":"governance/GLOBAL_INSTRUCTIONS.json","path":"governance/imports/aod-stable-baseline-v40.03r15.2.json","provenance_status":"legacy_bootstrap_hash_locked_noncanonical_fallback","role":"stable_project_release_baseline","sha256":"fd875c9ccc637b02b535821dfd241e62874303b1646bf36c9b01a83a35442b30"}],"policy":"Every AUTHORING cycle attempts the configured GitHub latest-release refresh. Bootstrap snapshots are explicit non-latest fallbacks until a successful candidate-scoped refresh; fallback does not block REVIEW or GO.","release_source_registry_path":"governance/REPOSITORY_RELEASE_SOURCES.json","schema_version":"3.1"}
